Original,Polite,Professional,Casual
ive been sitting in my wheel chair to move laundry and while the chair isnt terribly maneuverable due to the confines of the small laundry area at least it feels fairly safe even it it is still quite a struggle;joy,"I have been using my wheelchair to move laundry. While the chair isn't terribly maneuverable due to the confines of the small laundry area, it feels fairly safe, even though it is still quite a struggle.","I have been utilizing my wheelchair to transport laundry. Despite limited maneuverability due to the spatial constraints of the laundry area, the wheelchair feels relatively safe, although the process remains challenging.","Been using my wheelchair to move laundry. It's a bit of a pain to move around in the small laundry area, but at least it feels safe-ish, even though it's still hard."
i wait to hear if you feel i should find this is acceptable;joy,I am awaiting your opinion on whether this situation is acceptable.,I am awaiting your assessment regarding the acceptability of this matter.,Waiting to hear if you think this is okay.
im feeling very remorseful at the moment;sadness,I am feeling quite remorseful at this time.,I am currently experiencing significant remorse.,I'm feeling really bad about this.
talking to a very good friend who had just had a very bad experience which was changing his whole way of looking at life etc;sadness,I was speaking with a good friend who recently had a difficult experience that has significantly altered their perspective on life.,I was in conversation with a close acquaintance who recently underwent a challenging experience that is reshaping their overall outlook.,Was talking to a good friend who just went through something really tough that's changing how they see everything.
when i noticed two spiders running on the floor in different directions;anger,I noticed two spiders running on the floor in different directions.,I observed two arachnids moving across the floor in opposing trajectories.,I saw two spiders running around on the floor in different directions.
i am feeling so invigorated and so ready to keep pushing on to goal;joy,I am feeling quite invigorated and ready to continue working towards my goal.,I am feeling invigorated and prepared to continue pursuing the objective.,I'm feeling so energized and ready to keep going for my goal!
i feel like a super hero now that she naps amp sleeps in her crib;joy,I am feeling quite empowered now that she is napping and sleeping in her crib.,I feel a sense of accomplishment now that she is napping and sleeping in her crib.,I feel like a superhero now that she naps and sleeps in her crib!
i feel like its one of the most valuable tools in my art box;joy,I feel it is one of the most valuable tools in my art box.,I consider it to be one of the most valuable tools in my art collection.,I feel like it's one of the most valuable tools in my art box.
i began to feel a lot better about the situation and decided to just keep doing what i was doing;joy,I began to feel more positive about the situation and decided to continue with my current course of action.,I began to feel more optimistic about the situation and resolved to continue with my current strategy.,I started feeling better about it and decided to just keep doing what I was doing.
i am left feeling underwhelmed and ungrateful;sadness,I am left feeling somewhat underwhelmed and ungrateful.,I am left feeling underwhelmed and experiencing a sense of ingratitude.,I'm left feeling underwhelmed and ungrateful.
i feel that popular culture especially in the uk and the usa is mired in an unsavoury mix squalor and stupidity;joy,"I have the feeling that popular culture, particularly in the UK and the USA, is currently entangled in an unpleasant combination of degradation and foolishness.","Current popular culture, specifically in the UK and the USA, appears to be characterized by a regrettable confluence of squalor and a lack of intellectual stimulation.","I think pop culture, especially in the UK and the USA, is stuck in a gross mix of trash and dumb stuff."
i want to feel good but during that short week you don t get a chance;joy,"I would like to feel better, but during that brief period, the opportunity does not arise.","I am seeking an improved sense of well-being, however, the aforementioned time frame does not allow for such.","I want to feel good, but you don't get a chance during that week."
i feel like im alone in missing him and because of that i feel a bit foolish for missing him as much as i do;sadness,"I have the feeling that I am the only one who misses him, and as a result, I feel somewhat silly for missing him as much as I do.","I perceive a sense of isolation in my feelings of loss regarding him and, consequently, experience a degree of self-consciousness for the intensity of my emotions.","I feel like I'm the only one who misses him, so I feel kinda dumb for missing him this much."
i did though and woke up feeling terrific;joy,"I did, however, and I awoke feeling wonderful.","Nevertheless, that did occur, and I subsequently experienced a state of considerable well-being upon awakening.","I did, though, and woke up feeling great."
i know that part of the problem is that i feel like i have become more boring and less of an interesting person since those days;sadness,I am aware that part of the issue is that I feel I have become more mundane and less of a captivating individual since that time.,I recognize that a contributing factor to the issue is my perception that I have become less engaging and more commonplace as an individual since the aforementioned period.,I know part of the problem is that I feel like I've gotten more boring and less interesting since then.
i feel that anger toward someone else not caring about someone else being selfish creating a negative impression of someone else not noticing the person next to them not saying hello to someone they must recognize where is my good heart;love,I am experiencing feelings of frustration and disappointment regarding a perceived lack of consideration from others. I hope to find my way back to a place of empathy and compassion.,I am observing behaviors in others that I perceive as inconsiderate and self-centered. This is causing me to reflect on the importance of empathy and positive interactions.,It bugs me when people are so self-absorbed. Where's the love these days?
i feel so useless as i am bent on p here on the floor;sadness,"I am currently experiencing feelings of inadequacy and despair, as I find myself in a vulnerable position.","I am experiencing a sense of inefficacy and emotional distress, compounded by my current physical state.",I feel so worthless just lying here on the floor; so sad.
i know sweetie turning in a month but you re still years old it s hard to comprehend what s going on except that the feeling isn t pleasant;joy,"I recognize that while my dear one is approaching a significant milestone, they are still young and may struggle to understand the complexities of their emotions. My hope is that we can help them navigate these feelings.","While the child in question will soon reach a developmental milestone, their age may limit their understanding of current emotional experiences. It is important to provide support and guidance.","I know you're turning one soon, sweetie, but you're still little. It's probably hard to get what's going on, but it's okay to feel bad."
i feel bitter about me being like this but then i really am not;anger,"I am currently grappling with feelings of resentment towards myself, although I also question the validity of these sentiments.","I am experiencing conflicting emotions, including self-directed negativity, despite my awareness that such feelings may be unwarranted.","I'm annoyed with myself for feeling this way, but then again, maybe it's justified."
i thought it would be fun and therapeutic and that i would feel useful and helpful by keeping up her blog;joy,"I had hoped that maintaining her blog would be a fulfilling and beneficial experience, providing both enjoyment and a sense of purpose.","My initial expectation was that managing the blog would serve as a constructive and therapeutic activity, fostering a sense of contribution and personal satisfaction.",I thought working on her blog would be fun and make me feel useful.
i feel pretty confident in saying this;joy,I am quite confident in saying this.,I am confident in this assessment.,I'm pretty sure about this.
i don t speak more than a few words of the local language and i have to rely on him to translate the conversations for me i feel submissive;sadness,"As I only know a few words of the local language, I rely on him to translate our conversations, which makes me feel rather submissive.","Due to my limited proficiency in the local language, I rely on him for translation, which results in a feeling of dependence.","I barely know the language, so I need him to translate everything, and it makes me feel kinda helpless."
i just feel like if i can just make it through this week it will be ok;joy,"I feel that if I can simply get through this week, everything will be alright.",I believe that successfully navigating this week will resolve the situation.,"I just think if I can get through this week, I'll be good."
i want to be happy again and i have forgotten what it is like to feel content;joy,"I wish to experience happiness once more, as I seem to have forgotten the feeling of contentment.","I am seeking to regain a sense of happiness and contentment, which I seem to have lost.",I just wanna be happy again; I forgot what it feels like to be content.
i have just been feeling so thankful humbled and blessed for my family and where we are in our life;joy,"I am feeling very thankful, humbled, and blessed for my family and our current situation in life.","I am experiencing feelings of gratitude, humility, and appreciation for my family and our current circumstances.",I'm feeling so thankful and blessed for my family and where we're at right now.
i feel greatly humiliated by the beauty of everything;sadness,I find myself feeling rather humbled by the beauty around me; it evokes a sense of sadness.,"The overwhelming beauty induces a feeling of humiliation, accompanied by sadness.",The beauty of everything is making me feel super bummed out.
im feeling a bit needy i keep thinking i would appreciate any attention but of course that is not true;sadness,"I am experiencing feelings of neediness and find myself longing for attention, though I recognize this may not be entirely accurate; it is causing me sadness.","I am currently experiencing feelings of neediness and a desire for attention, which is contributing to a sense of sadness.","I'm feeling kinda needy and wanting attention, which is making me sad, but I know it's not really what I want."
i feel them at all and cannot just be content becoming a widow nun derby girl or something is what they become for me in my head;joy,"I am unable to fully connect with them, and struggle to find contentment; in my mind, they transform into something akin to a widow, nun, or derby girl, which brings me joy.","I am experiencing a disconnect and struggling to find contentment, which results in feelings of joy.","I can't connect with them, and I can't just be happy! They become like widow nuns or derby girls in my head, which is funny to me."
i feel privileged and beyond lucky to have met him;joy,I feel very fortunate and incredibly lucky to have had the opportunity to meet him.,I am grateful and privileged to have met him.,I feel so lucky and privileged to have met him!
i feel discouraged and realize face palm that i need to look at things with a different perspective to be grateful about anything i can find;sadness,"I feel disheartened and, with some self-awareness, realize that I need to adopt a different perspective to appreciate the positive aspects I can find.",I am feeling discouraged and recognize the need to shift my perspective in order to identify and appreciate positive aspects.,I'm feeling discouraged and face palm realizing I need to look at things differently to be grateful for anything.
i want to feel pretty or handsome or something;joy,"I would like to feel attractive or handsome, which would bring me joy.",I am experiencing a desire to feel attractive.,"I just wanna feel good about how I look, ya know?"
i have to say i really feel a little useful for the progress of the second half the replacement of the shirt plus the coach s hairdryer;joy,"I must say, I feel a sense of usefulness regarding the progress made in the latter half, specifically with the shirt replacement and the coach's hairdryer.",I feel a sense of contribution to the progress made regarding the replacement of the shirt and the implementation of the coach's hairdryer.,"Gotta say, I actually feel kinda useful for the progress on the shirt thing and the hairdryer."
i do feel very excited about travelling because it s not often that i get to travel and it s definitely not often that i get to do it for free;joy,"I feel very excited about traveling, as opportunities to travel, especially without cost, are infrequent.","I am experiencing significant excitement regarding the upcoming travel opportunity, which is a rare and complimentary experience.","I'm super stoked about traveling 'cause I don't get to do it much, and definitely not for free!"
i walk into a restaurant well any public place i feel like all eyes are on me and i feel really paranoid;fear,"When I enter a restaurant, or any public place, I often feel as though I am the center of attention, which makes me feel quite paranoid.","In public settings, such as restaurants, I experience a heightened sense of self-consciousness, leading to feelings of paranoia.","When I walk into a restaurant or anywhere public, I feel like everyone's staring at me, and I get super paranoid."
ill just cut amp paste it next time i feel the urge to type something as whiney as that;sadness,I will simply use the copy and paste function in the future should I feel the need to express something as complaining as that.,I will utilize the copy and paste function in subsequent instances where I feel compelled to express similar sentiments.,"Next time I feel like typing something that whiney, I'll just copy and paste it."
i was feeling and was surprised when i told him i felt fine no fatigue;surprise,"I was experiencing certain sensations and was surprised when, upon inquiry, I indicated that I felt fine and not fatigued; this was unexpected.",I experienced a specific sensation and was surprised to report feeling well without any fatigue symptoms.,"I felt a certain way and was surprised when I said I felt fine, no fatigue - total surprise!"
i especially enjoyed listening to shotgun lovesongs on audio book as it just seemed to give even more depth and feeling to what is truly a very special novel;joy,"I particularly appreciated listening to ""Shotgun Lovesongs"" as an audiobook, as it seemed to enhance the depth and emotion of what is truly a remarkable novel.","Listening to the audiobook version of ""Shotgun Lovesongs"" proved particularly enjoyable, adding depth and feeling to an already compelling novel.","I loved listening to ""Shotgun Lovesongs"" on audiobook � it made the story even deeper and more emotional, it's such a special book!"
i can say is that i feel like myself when i put on a skirt heels and lipstick and when i wear clothing which has come to be accepted as neutral and nondescript like a t shirt and jeans i dont feel like myself;love,"I can only express that I feel most like myself when I wear a skirt, heels, and lipstick. Conversely, when I wear clothing that is generally considered neutral, such as a t-shirt and jeans, I do not feel like myself.","My personal sense of self is most strongly affirmed when wearing a skirt, heels, and lipstick. In contrast, I do not experience the same sense of self when wearing attire commonly perceived as neutral or nondescript, such as a t-shirt and jeans.","All I can say is I feel like *me* when I'm rocking a skirt, heels, and lipstick. But when I wear, like, jeans and a t-shirt, I just don't feel like myself, ya know?"
i am sure she makes all waiting couples feel this way but we left feeling like she is pulling for us and she will be so thrilled when it all works out;joy,"I am certain she makes all couples feel this way, but we departed with the distinct feeling that she is genuinely rooting for our success and will share in our joy when everything comes to fruition.","While I imagine she instills this sentiment in all waiting couples, we left with the impression that she is genuinely invested in our success and will be delighted when we achieve a positive outcome.","I bet she makes everyone feel like this, but we left feeling like she's totally on our side and will be so stoked when things finally work out for us."
i feel rude taking pictures of them;anger,I feel it would be discourteous to take pictures of them.,"I am hesitant to take photographs of them, as it feels inappropriate.",I feel kinda rude taking pictures of them.
i got a sore throat then a runny nose then a full blown congested head cold which fell on the bank holiday tuesday and has left me feeling low and blue and bleurgh since then;sadness,"I developed a sore throat, followed by a runny nose, and then a congested head cold, which unfortunately occurred on the bank holiday Tuesday. I have been feeling unwell and quite low since then.","I experienced a sore throat, followed by rhinorrhea, and subsequently developed a head cold. This occurred on Tuesday, a bank holiday, and I have been experiencing a decline in my overall well-being since then.","I got a sore throat, then a runny nose, and then a total head cold that hit me on Tuesday, the bank holiday. I've been feeling pretty blah since then."
i meet up with the team i don t feel welcomed or accepted;joy,"When I meet with the team, I do not feel as though I am welcomed or accepted.","During team meetings, I perceive a lack of integration and acceptance.","When I hang out with the team, I don't feel like I really fit in or belong."
i feel completely restless and then i feel fine where i am;fear,"I experience feelings of restlessness, which are then followed by a sense of contentment with my current situation.",I alternate between periods of pronounced restlessness and periods of satisfaction with my current environment.,"I keep feeling super restless, but then I'm suddenly okay with where I am."
i feel complimented or insulted;anger,I am uncertain whether to interpret the situation as a compliment or an insult.,"The situation presents an ambiguity, leaving me uncertain if it is intended as a compliment or an affront.",I can't tell if I should be flattered or offended.
i am feeling lots of movement now but gar is unsure whether he feels or not;fear,"I am experiencing a lot of fetal movement at present, but my partner, Gar, is uncertain whether he can feel it.","I am currently perceiving significant fetal movement; however, my partner, Gar, is unsure if he can detect it.","I'm feeling tons of movement now, but Gar's not sure if he can feel it."