Original,Polite,Professional,Casual
i really have much of a clue how my ex actually feels or felt about anything really except that he hated it when i didnt screw the lids back on jars in the kitchen;anger,"I'm not entirely sure how my ex-partner feels or felt about things, except that he disliked it when I didn't tighten the lids on jars in the kitchen.","I lack a clear understanding of my former partner's feelings, except for his expressed frustration when I failed to properly secure jar lids.","I have no idea what my ex actually thinks or thought, except he hated it when I didn't screw the jar lids on."
i woke up feeling ugly and im sure i looked like a hot mess;sadness,I woke up feeling unattractive and I suspect I looked disheveled.,"This morning, I felt unattractive, and I believe my appearance reflected this feeling.",I woke up feeling ugly and I'm sure I looked like a hot mess.
i feel a strange obligation to be interested and encouraging even when the kid is clearly taking the piss;fear,"I feel a certain responsibility to show interest and encouragement, even when it seems someone is taking advantage of the situation.","I experience an obligation to maintain interest and offer encouragement, despite evidence suggesting exploitation.",I feel a strange obligation to be interested and encouraging even when the kid is clearly taking the piss.
i contributed my ideas and opinions during discussions and i feel that i contributed ideas that were valued and taken into consideration;joy,"I shared my ideas and opinions during discussions, and I believe my contributions were valued and considered.","I actively contributed ideas and opinions during team discussions, and I perceive that my input was valued and duly considered.",I contributed my ideas and opinions during discussions and I feel that I contributed ideas that were valued and taken into consideration.
i was starting feel a bit regretful for the break up so i thought id write this list to remind me why i broke it off;sadness,"I was beginning to feel some regret about the breakup, so I thought writing this list would remind me of the reasons for my decision.","I experienced initial feelings of regret regarding the dissolution of the relationship. Therefore, I decided to create this list as a reminder of the original reasons for the separation.",I was starting feel a bit regretful for the break up so I thought I'd write this list to remind me why I broke it off.
i cannot wait for school to end so i can change into a tank top and shorts and head to the gym and then to release my toxins and stretch and realize that homework is important but feeling good is even better;joy,"I am eagerly anticipating the end of the school day so I can change into more comfortable clothing and go to the gym. Afterward, I plan to relax and stretch, acknowledging the importance of homework, but also prioritizing my well-being.","I am looking forward to the end of the school day to change into appropriate athletic wear and engage in physical exercise at the gym. Following my workout, I intend to de-stress and stretch, recognizing the need to balance academic responsibilities with personal wellness.","Can't wait for school to be over so I can change into some shorts and a tank top and hit the gym, then chill out and stretch. Homework's important, but feeling good is better!"
i don t know this shit happens but every time i find out about yet another secret makeshift graveyard full of women s bones i feel that enraged impotence just like it was the first time;anger,I am consistently disturbed by the discovery of clandestine burial sites containing the remains of women. Each instance evokes a sense of profound helplessness and indignation.,"The recurring discovery of clandestine burial sites containing the remains of women consistently elicits a strong emotional response, specifically a feeling of enraged impotence.","It sucks that this keeps happening, but every time I hear about another secret graveyard full of women's bones, I get this feeling of helpless rage, like it's the first time."
i do not feel outraged by the change in name changing tanjore to thanjavur and mysore to mysuru makes more sense but since the previous cities were named by the very people who made them what they are today from mere villages to major power centres it s not a crime to retain those names;anger,"While I am not personally offended by the renaming of Tanjore to Thanjavur and Mysore to Mysuru, as the new names may be more linguistically consistent, I believe there is merit in preserving the original names given by those who developed these cities into prominent centers of power.","I do not experience outrage regarding the renaming of Tanjore to Thanjavur and Mysore to Mysuru. While these changes may reflect linguistic preferences, the original names hold historical significance as they were designated by the communities that transformed these locations into significant urban centers. Therefore, retaining those names should not be viewed as an offense.","I'm not really mad about them changing Tanjore to Thanjavur and Mysore to Mysuru. It kinda makes sense, but since the original names were given by the people who made those cities what they are today, it's not a big deal to keep using them."
i am more well read and i feel like im becoming more intelligent and articulate;joy,"I am finding myself to be more knowledgeable, and I believe that I am developing improved intelligence and communication skills.","I am observing an increase in my overall knowledge base, accompanied by improvements in both intellectual capacity and communication proficiency.","I'm reading more, and I feel like I'm getting smarter and better at explaining myself."
i feel so terrified to tell her;fear,I am experiencing considerable anxiety about sharing this information with her.,I am experiencing a significant level of apprehension regarding the disclosure of this information to her.,I'm so scared to tell her.
i feel pretty rotten;sadness,I am feeling quite unwell and experiencing sadness.,I am experiencing a decline in mood and feelings of sadness.,I'm feeling pretty down and sad.
im not really terrified of childbirth this time around and even though i know no matter what unexpectedly pops up you really can survive it and even though the author of my baby planner would be beaming with pride that i followed her instructions to the letter im still feeling a bit uncertain;fear,"While I am not as frightened about childbirth this time, I still feel uncertain despite my understanding that one can survive unexpected complications, and even though I have followed my baby planner's instructions closely.","Although I am experiencing less fear regarding childbirth compared to previous experiences, some uncertainty remains. I am confident in my ability to manage any unforeseen challenges. Despite adhering to recommendations from my baby planner, I am still feeling apprehensive.","I'm not super scared of childbirth this time, and I know I can handle anything that comes up. Even though I followed my baby planner's advice perfectly, I'm still a bit unsure."
i own the brushes are constantly used and i feel that they are a worthwhile investment;joy,"I believe that the brushes I own are a worthwhile investment, as they are constantly in use.","The brushes in my possession represent a sound investment, given their consistent utilization and overall value.","I love my brushes; I use them all the time, and they're totally worth it."
i didnt regret anything after bought this and i feel so satisfied about it thankyouu lt;joy,"I have no regrets about purchasing this item, and I am very satisfied with it. Thank you.",I am exceedingly satisfied with this purchase and have no reservations. Thank you.,I don't regret buying this at all; I'm super happy with it. Thanks!
i feel lonely and he always talks to me;sadness,"I am feeling lonely, but I appreciate his consistent conversations with me.","I am experiencing feelings of loneliness. However, I value his consistent communication.","I feel lonely, but it's cool that he always talks to me."
i feel repressed enough as it is and these sorts of repressive measures and guidelines only succeed in making me want to have more sex and partaking of the revelry that comes with being a dirty slut;sadness,"I feel quite repressed already, and these sorts of restrictive measures and guidelines only serve to increase my desire for intimacy and the associated celebrations. I am feeling rather sad.",Current restrictions are negatively impacting morale and creating a desire for behaviors contrary to the intended outcome. This is causing distress.,"I'm already feeling held back, and these rules just make me want to rebel and party even harder. Feeling down about it."
i can only feel rejected and tossed aside and hurt for so long before i get enough guts to just pick up and move on;sadness,"I can only endure feelings of rejection, abandonment, and hurt for a limited time before I feel compelled to gather my courage and move forward. I am feeling rather sad.",Prolonged feelings of rejection and hurt are unsustainable and will inevitably lead to disengagement and departure. This is a matter of concern.,I can only take feeling rejected and hurt for so long before I just bail. Feeling sad about it.
i feel eager to push forward but so far havent applied myself completely to it;joy,"I am feeling quite eager to progress, although I have not yet fully dedicated myself to the task. I am feeling joyful.","There is a strong desire to advance, however, full commitment has not yet been achieved. This presents an opportunity for improvement.","I'm really wanting to move forward, but I haven't totally put my back into it yet. I'm feeling good."
i feel overwhelmed by my circumstance in all of my mere human ness i will remember that god has landed here;surprise,"I feel overwhelmed by my current situation, and in my human frailty, I will remember that God has intervened. I am feeling surprised.",The current circumstances are creating a feeling of overwhelm. It is important to remember the larger forces at play.,"I'm feeling totally overwhelmed by everything, but I'm trying to remember that something bigger is going on. I'm surprised by it all."
im feeling a little vulnerable;fear,I am feeling somewhat vulnerable at the moment. I am feeling fearful.,There is a current feeling of vulnerability.,I'm feeling a bit exposed right now. I'm scared.
i wouldnt buy it but if someone gave me some id wear it if i was feeling a particularly vain that day but not really;sadness,"While it's not something I would purchase myself, I might wear it if it were a gift and I was feeling particularly vain, though it's not really my style.","I would not personally invest in this item. However, under specific circumstances, such as receiving it as a gift, I might wear it.","I wouldn't buy it myself, but if someone gave it to me, I'd wear it if I was feeling extra vain that day, but probably not."
i still don t feel devastated by the break up;sadness,I am still not feeling particularly devastated by the breakup.,I have yet to experience significant emotional distress following the dissolution of the relationship.,I'm still not super bummed about the breakup.
i am at day and i am feeling terrific;joy,"It is daytime, and I am feeling quite wonderful.","It is currently daytime, and I am experiencing positive emotions.","It's daytime, and I'm feeling great."
i almost feel a little bit weird about saying anything because it would almost feel like gossip;surprise,"I almost feel hesitant to say anything, as it might be construed as gossip.","I am reticent to comment, as it could be perceived as engaging in gossip.",I almost feel weird saying anything because it would feel like gossip.
i have been feeling suitably punished;sadness,I have been feeling as though I have received an appropriate amount of punishment.,I feel I have experienced consequences commensurate with any potential transgression.,I've been feeling like I've been punished enough.
i always feel vaguely suspicious giving my personal details to random strangers i tell myself not to give her my real date of birth;fear,"I must admit, I often feel a bit apprehensive sharing my personal information with people I don't know well. I'm reminding myself not to disclose my actual date of birth.",I consistently experience a degree of unease when providing personal details to unfamiliar individuals. I am consciously choosing not to provide my accurate date of birth.,Giving my personal info to strangers always feels a little sketchy. Definitely not telling her my real birthday.
i do think as he was feeling a bit of humiliated they did not have an excellent alternative they wanted all of us to clarify the fact that stop mortgage is working;sadness,"It is my understanding that, given his apparent feelings of humiliation and the absence of a superior option, they wished for us to confirm the efficacy of the stop mortgage program.","Given his evident feelings of humiliation and the lack of a more suitable alternative, it is my understanding that they sought affirmation from all parties regarding the functionality of the stop mortgage initiative.","I think since he was feeling kinda humiliated and they didn't have a great option, they wanted us all to say that the stop mortgage thing works."
i cant seem to get passed feeling stunned;surprise,I am finding it difficult to move beyond this feeling of shock.,I am currently experiencing difficulty processing this feeling of profound astonishment.,I just can't get over how stunned I feel.
i began feeling shaky my heart was sort of skipping around i felt like someone who had been drinking coffee all day long;fear,"I started to feel unsteady, and my heart was racing. I felt similar to someone who had consumed coffee throughout the entire day.","I began to experience tremors, accompanied by heart palpitations. My physiological state was comparable to that of someone who had ingested excessive caffeine.","I started feeling shaky, and my heart was all over the place. Felt like I'd been chugging coffee all day."
i hope all of you epers feel terrific too;joy,I trust that all of you are feeling equally well.,I hope that all of you are experiencing a similarly positive emotional state.,Hope you're all feeling awesome too!
i do reviews only on my personal experience please do not feel insulted or put off by my words i intend only to advise;anger,"I conduct reviews based solely on my personal experiences. Please do not feel insulted or discouraged by my words, as my intention is only to offer advice.",Reviews are based on personal experience and are intended to provide constructive feedback. The content should not be interpreted as offensive or discouraging.,"I only review stuff based on what I've experienced, so don't take it personally if I say something you don't like. I'm just trying to help."
i feel very vulnerable and exposed too when i was in school i never thought this was how my life was going to be;fear,"I am feeling quite vulnerable and exposed. When I was in school, I never imagined my life would unfold in this way.",I am experiencing feelings of vulnerability and exposure. My current circumstances are not aligned with the expectations I held during my education.,I'm feeling super vulnerable and out there right now. I never thought my life would end up like this back in school.
i feel for the death of this innocent child i dont trust her or her story;joy,"I sympathize with the loss of this innocent child, but I must admit I have reservations about trusting her or her narrative.","While expressing sympathy for the death of this child, there are reservations regarding the credibility of the individual and their account.","I feel bad about that kid dying, but I just don't trust her or what she's saying."
i do know that when i see the colour purple it makes me feel calm;joy,I have observed that the color purple has a calming effect on me.,Observation indicates that the color purple elicits a feeling of calm.,"Seeing purple just chills me out, you know?"
im feeling less grumpy after that;anger,I am feeling less irritable after that.,"Affective state has improved, reflecting decreased irritability.","Feeling less grumpy now, thankfully."
i need to be able to pursue the creative opportunities i crave without feeling like i m throwing my family under the bus funny how they still want to be fed even when i have a big gig to prepare for;surprise,I would appreciate the opportunity to pursue creative endeavors without compromising my family's needs. It is sometimes challenging to balance personal aspirations with familial responsibilities.,"Balancing creative pursuits with family commitments presents a challenge. Securing opportunities for creative growth is a priority, while ensuring family needs are met.",I need to chase my creative dreams without screwing over my family. It's funny how they still need food even when I have a ton of work to do.
i like the new ones better i feel they are superior to the originals in every single way;joy,I find the newer versions to be more appealing and feel they have improved upon the original designs significantly.,The updated versions are preferred due to their perceived improvements over the original models.,I like the new ones way better. They're just better than the old ones in every way.
i can feel a sense of comfort with nostalgic sweetness;love,I am experiencing a comforting and nostalgic feeling of sweetness.,A sense of comfort and nostalgia is being experienced.,I feel all warm and fuzzy with sweet memories.
i came home with these bits and bobs feeling very pleased with myself and ready for some sunny british weather;joy,"I returned home with these items and felt quite pleased with my purchases, looking forward to enjoying some pleasant British weather.","Upon returning home with these items, I felt satisfied and anticipated favorable weather conditions.","I got home with this stuff and felt pretty happy, ready for some nice British weather."
i feel strongly that those who finger point and wish to control other peoples lives are not feeling very peaceful and content within their own lives;joy,It is my strong belief that individuals who criticize and attempt to govern the lives of others may be experiencing inner dissatisfaction and unrest.,It is my opinion that those who attempt to control others' lives are likely experiencing internal conflict and discontent.,I really think that people who try to control others and point fingers are just unhappy with themselves.
i feel no need to offer it though i do feel a bit suspicious in the area of is she doing this just to try and lump all the people who have bothered to argue cogently with her in with the woman hating misogynists;fear,"While I don't feel obligated to offer it, I am somewhat concerned about whether this is an attempt to associate those who have engaged in reasoned debate with misogynistic individuals; fear.","I do not feel it necessary to offer that, although I do have some reservations regarding the potential motive of conflating those who have presented logical arguments with misogynistic elements; fear.","I don't really need to say it, but I'm a little suspicious if she's just trying to lump everyone who's argued with her into the woman-hating misogynist group; fear."
i rarely feel inspired and ready to write;joy,I seldom feel inspired and prepared to write; joy.,I infrequently experience the feeling of being inspired and ready to write; joy.,I rarely feel like I'm ready and pumped to write; joy.
i feel loyal to skirtsports;love,I feel a sense of loyalty toward SkirtSports; love.,I experience a sense of loyalty to SkirtSports; love.,I'm loyal to SkirtSports; love.
i have to think for days what to text him and i feel really nervous if he doesnt answer;fear,"I often spend several days considering what to text him, and I feel quite anxious if he does not reply; fear.","I require a significant amount of time to deliberate on what to text him, and I experience anxiety if I do not receive a response; fear.",I gotta think for days about what to text him and I get super nervous if he doesn't answer; fear.
im kinda relieve but at the same time i feel disheartened;sadness,"I am somewhat relieved, but simultaneously feel disheartened; sadness.","I experience a sense of relief, although I am also disheartened; sadness.",I'm kinda relieved but also bummed out; sadness.
i have tuned in to some country music the past year but it has only left me feeling empty;sadness,"Over the past year, I've listened to some country music, but it has unfortunately left me feeling rather empty and sad.",My engagement with country music over the past year has resulted in feelings of emptiness and sadness.,"I've been listening to country music lately, but it just makes me feel empty and sad."
i have panic attacks when the phone rings and just feel so isolated;sadness,"I experience panic attacks when the phone rings, which leads to feelings of isolation.","Phone calls trigger panic attacks, resulting in feelings of isolation.",I freak out when the phone rings and feel so alone.
i have had a seizure i am not allowed to take part even though i feel fine;joy,"Despite feeling well, I am not permitted to participate due to a past seizure.","Due to a previous seizure, I am restricted from participating, despite my current well-being.","I had a seizure once, so now I'm not allowed to join in even though I feel fine."
i firmly believe that you shouldnt have to spend a lot to look feel fantastic and i love mixing style steals with higher end items;joy,"I strongly believe that looking and feeling fantastic shouldn't require excessive spending, and I enjoy combining affordable finds with higher-end items.",My philosophy is that achieving a fantastic appearance and feeling should not necessitate significant expenditure. I advocate for combining affordable and high-end items.,"I think you don't have to spend a ton to look and feel great, and I love mixing cheap stuff with fancy stuff."
i feel like such a goof ball for the things i am curious about but i see life as this adventure that i get to embark on and i want to squeeze every ounce of good from it;surprise,"I sometimes feel a bit foolish for my curiosities, but I view life as an exciting adventure and want to experience all the good it has to offer.","While my curiosities sometimes make me feel self-conscious, I maintain a perspective of life as an adventure and seek to maximize its positive aspects.","I feel like such a dork for the stuff I'm curious about, but I see life as this cool adventure and wanna get all the good stuff out of it."
i feel i have rushed moments where i begin to take this life here for granted i just look at them they look at me and my graced life becomes the stage again warts crushed worms under foot and all the other conflicts that come with it;anger,"I find myself occasionally taking this life for granted. When I reflect on my circumstances, my appreciation is renewed, even amidst the challenges and frustrations I face.","I have observed instances where I risk taking my current life for granted. However, upon further consideration, I am reminded of the privileged position I hold, despite the inevitable conflicts and difficulties that arise.","Sometimes I feel like I forget how good I have it. Then I check myself and remember all the good stuff, even with the annoying stuff that comes with it."
i feel for him and im sympathetic because i have known people who have struggled with alcohol and drug addiction;love,"I have empathy for him and am sympathetic to his situation, as I have known others who have struggled with alcohol and drug addiction.","I extend my empathy and understanding towards him, given my prior experience with individuals confronting alcohol and substance dependencies.","I feel for him, you know? I've seen people struggle with the same stuff, like drinking and drugs."
i do feels amazing and is an investment for something greater;joy,"I feel amazing, and I believe this is a valuable investment for the future.","I am experiencing a profound sense of well-being, which I consider to be a worthwhile investment towards future endeavors.","I feel great, and it's like setting myself up for something even better."
i have a positive or negative experience depends largely on how much i feel control was either respected or taken from me;joy,Whether I have a positive or negative experience largely depends on the degree to which my sense of control is respected or disregarded.,"My overall experience, whether positive or negative, is significantly influenced by the extent to which my autonomy is either maintained or compromised.",How I feel � good or bad � really depends on whether I feel like I'm in control or not.
im just feeling insecure and while i can easily diagnose these dispositions it doesnt help;fear,"I am feeling insecure, and while I can easily identify these feelings, it does not alleviate them.","I am currently experiencing feelings of insecurity. While I am capable of accurately diagnosing these sentiments, doing so does not necessarily provide relief.","I'm feeling insecure, and even though I know why, it doesn't really help."
